source_file,cable_date,cable_from,cable_to,cable_subject,cable_tags,cable_ref,doc_number,classification,declass_date,concepts
filename_1738526832197.pdf,22 MAR 1974,AMEMBASSY LA PAZ,USCINCSO,NA,"MASS, PINT, BL",NA,1974LAPAZ01760,UNCLASSIFIED,30 JUN 2005,"PROCUREMENT, MILITARY TRAINING, MILITARY SALES, NAVAL SHIPS, TRAINING SHIPS"
filename_1738526832673.pdf,22 MAR 1974,AMEMBASSY LA PAZ,SECSTATE WASHDC 2620,VISIT OF LOS TEAM TO LATIN AMERICA,"PBOR, BL",(A) STATE 53203; (B) LA PAZ 1617,1974LAPAZ01791,UNCLASSIFIED,30 JUN 2005,"LAW OF THE SEA, MEETINGS, MEETING DELEGATIONS, PERSONNEL TRAVEL, REORGANIZATIONS, MINISTERIAL VISITS"
filename_1738526832929.pdf,25 MAR 1974,AMEMBASSY LA PAZ,SECSTATE WASHDC 2639,"VISIT TO WASHINGTON--DR. MARCOS LEZAMA, VENEZUELAN WRITER",OTRA VE BL,NA,1974LAPAZ01828,UNCLASSIFIED,30 JUN 2005,n/a
filename_1738526832964.pdf,25 MAR 1974,AMEMBASSY LA PAZ,SECSTATE WASHDC 2630,NA,SNAR BL,STATE 055765,1974LAPAZ01807,UNCLASSIFIED,30 JUN 2005,"DRUG CONTROL, FOREIGN ASSISTANCE PROGRAMS, PERSONNEL ASSIGNMENTS"
filename_1738526833104.pdf,25 MAR 1974,AMEMBASSY LA PAZ,SECSTATE WASHDC 2640,BOLIVIAN VIEWS ON PROPOSED PANAMA CANAL TOLL INCREASE REFERENCE: STATE 58007,"PFOR, PN, BL",NA,1974LAPAZ01831,UNCLASSIFIED,30 JUN 2005,"INTERNATIONAL CANALS, TOLLS, FOREIGN POLICY POSITION"
filename_1738526833899.pdf,28 MAR 1974,AMEMBASSY LA PAZ,USINFO WASHDC,NA,"SCUL, XM, ANDES PACT",NA,1974LAPAZ01919,UNCLASSIFIED,30 JUN 2005,"COMMUNITY RELATIONS, ECONOMIC COOPERATION, SPEECHES, LANGUAGE SERVICES"
filename_1738526834159.pdf,29 MAR 1974,AMEMBASSY LA PAZ,SECSTATE WASHDC 2690,TRADE OPPORTUNITY: HOTEL DEVELOPMENT IN COCHABAMBA,"BEXP, ETRD, BL",NA,1974LAPAZ01970,UNCLASSIFIED,30 JUN 2005,"FOREIGN INVESTMENTS, HOTELS, INVESTMENT OPPORTUNITY REPORTS"
filename_1738526834405.pdf,29 MAR 1974,AMEMBASSY LA PAZ,SECSTATE WASHDC 2681,TRADE PROMOTION: U.S. EXPORTS TO BOLIVIA,"BEXP, BL",NA,1974LAPAZ01945,UNCLASSIFIED,30 JUN 2005,n/a
filename_1738526834460.pdf,29 MAR 1974,AMEMBASSY LA PAZ,SECSTATE WASHDC 2682,TECHNICAL ASSISTANCE REQUESTED FROM GOB,"EMIN, BL",WORLD BANK LOAN TO MINING SECTOR,1974LAPAZ01946,UNCLASSIFIED,30 JUN 2005,"TECHNICAL ASSISTANCE, MINING INDUSTRY, BANK LOANS, PROGRAMS (PROJECTS), CONSULTANTS"
filename_1738526834955.pdf,01 APR 1974,AMEMBASSY LA PAZ,SECSTATE WASHDC 2703,NA,"BDIS, ETRD, EAGR, BL, US, (MORAN, J ANTHONY), (APPLEGATE), (YOUNGQUIST)",NA,1974LAPAZ02004,UNCLASSIFIED,30 JUN 2005,"SUGAR, DISPUTE SETTLEMENT, TRADE COMPLAINTS, LAND NATIONALIZATION, COURTS"
filename_1738526835052.pdf,02 APR 1974,AMEMBASSY LA PAZ,SECSTATE WASHDC 2714,RECENT DEVELOPMENTS IN BOLIVIA'S QUEST FOR AN ACCESS TO THE SEA. PANAMA FOR USCINCSO,"PINT, PFOR, BL, CI, PE",NA,1974LAPAZ02024,UNCLASSIFIED,30 JUN 2005,"LANDLOCKED COUNTRIES, CHIEFS OF STATE MEETINGS, FOREIGN POLICY POSITION, ACCESS TO PORTS"
filename_1738526835233.pdf,02 APR 1974,AMEMBASSY LA PAZ,SECSTATE WASHDC 2719,NA,"PFOR, PN, BL","LA PAZ 1831, STATE 58007",1974LAPAZ02035,UNCLASSIFIED,30 JUN 2005,"INTERNATIONAL CANALS, TOLLS, FOREIGN POLICY POSITION"
filename_1738526835365.pdf,04 APR 1974,AMEMBASSY LA PAZ,SECSTATE WASHDC 2732,NA,"BEXP, AFSP",STATE 235324 OF 11/30/73 STATE 240150 OF 12/8/73 LA PAZ 7565 OF 12/17/73,1974LAPAZ02080,UNCLASSIFIED,30 JUN 2005,n/a
filename_1738526835897.pdf,04 APR 1974,AMEMBASSY LA PAZ,SECSTATE WASHDC IMMEDIATE 2734,NA,PFOR BL,NA,1974LAPAZ02085,UNCLASSIFIED,30 JUN 2005,"MEETINGS, WATERWAY ACCESS"
filename_1738526836192.pdf,04 APR 1974,AMEMBASSY LA PAZ,SECSTATE WASHDC 2729,NA,"PINT, PFOR, BL, CI, PE",LA PAZ 2024,1974LAPAZ02065,UNCLASSIFIED,30 JUN 2005,"FOREIGN POLICY POSITION, POLITICAL PARTIES, PUBLIC ATTITUDES, MEETINGS, WATERWAY ACCESS"
filename_1738526836275.pdf,05 APR 1974,AMEMBASSY LA PAZ,SECSTATE WASHDC 2753,NA,PFOR BL CU AR,NA,1974LAPAZ02117,UNCLASSIFIED,30 JUN 2005,"MEETING AGENDA, FOREIGN RELATIONS, DIPLOMATIC RELATIONS ESTABLISHMENT, FOREIGN MINISTERS MEETINGS,"
filename_1738526836560.pdf,05 APR 1974,AMEMBASSY LA PAZ,SECSTATE WASHDC 2164,NA,"EAID, UNDP, ECRP, BL",STATE 042239 SUMMARY: THIS MESSAGE IS MISSION'S RESPONSE TO QUESTIONS IN PARAGRAPH 5 OF REFTEL IN SAME LETTERED SEQUENCE. END SUMMARY.,1974LAPAZ02148,UNCLASSIFIED,30 JUN 2005,"TECHNICAL ASSISTANCE, CERP 0008, DEVELOPMENT PROGRAMS, US CONGRESSIONAL PRESENTATIONS, FOREIGN"
filename_1738526837421.pdf,05 APR 1974,AMEMBASSY LA PAZ,SECSTATE WASHDC PRIORITY 2755,NA,"CASC (GOULDING, HARRY)",NA,1974LAPAZ02119,UNCLASSIFIED,30 JUN 2005,n/a
filename_1738526837509.pdf,08 APR 1974,AMEMBASSY LA PAZ,SECSTATE WASHDC PRIORITY 2781,PRESIDENT BANZER ANNOUNCES NEW CONCEPT OF GOVERNMENT,"PINT, PFOR, BL",NA,1974LAPAZ02200,UNCLASSIFIED,30 JUN 2005,"PRESIDENT, CABINET, REORGANIZATIONS, POLITICAL SITUATION, POLITICAL PARTIES"
filename_1738526837678.pdf,08 APR 1974,AMEMBASSY LA PAZ,SECSTATE WASHDC 2774,NA,"EGEN, BL",STATE 065938,1974LAPAZ02176,UNCLASSIFIED,30 JUN 2005,"POPULATION, MEETING AGENDA, MEETINGS, MEETING DELEGATIONS"
filename_1738526838576.pdf,09 APR 1974,NA,NA,NA,"PBOR, PFOR, BL, OAS",NA,1974LAPAZ02230,UNCLASSIFIED,30 JUN 2005,"LANDLOCKED COUNTRIES, FOREIGN MINISTERS MEETINGS, ACCESS TO PORTS"
filename_1738526838836.pdf,09 APR 1974,AMEMBASSY LA PAZ,SECSTATE WASHDC 2795,NA,n/a,NA,1974LAPAZ02238,UNCLASSIFIED,30 JUN 2005,n/a
filename_1738526839191.pdf,09 APR 1974,AMEMBASSY LA PAZ,SECSTATE WASHDC 2786,"TEXT OF ""DECLARATION OF COCHABAMBA""","PINT, PFOR, BL",NA,1974LAPAZ02209,UNCLASSIFIED,30 JUN 2005,"LANDLOCKED COUNTRIES, ACCESS TO PORTS"
filename_1738526839233.pdf,10 APR 1974,AMEMBASSY LA PAZ,SECSTATE WASHDC 2812,NA,"EFIN, EMIN, ENRG, BL","(A) LA PAZ 435; (B) LA PAZ 1115; (C) LA PAZ 3126 SUMMARY: EMBASSY RECOMMENDS AGAINST OPIC INSURANCE FOR LONE STAR BOLIVIA GROUP FOR SAME REASONS AS IN UNION OIL CASE, MAINLY THAT OPIC INSURANCE NOT INSTRUMENTAL FOR FIRM'S DECISION AND, ON BALANCE, STILL NOT ADVISABLE DUE TO SENSITIVITY OF SECTOR FROM OVERALL USG POLICY STANDPOINT. EMBASSY MAY RECOMMEND AGAINST INSURANCE FOR NEW JERSEY ZINC ON SIMILAR GROUNDS, BUT LACKS SUFFICIENT INFORMATION. END SUMMARY.",1974LAPAZ02284,UNCLASSIFIED,30 JUN 2005,"INSURANCE, BUSINESS FIRMS, MINING INDUSTRY, LOANS"
filename_1738526839846.pdf,15 APR 1974,AMEMBASSY LA PAZ,SECSTATE WASHDC 2826,NA,PBOR PFOR BL,NA,1974LAPAZ02306,UNCLASSIFIED,30 JUN 2005,"LANDLOCKED COUNTRIES, PRESS COMMENTS, DIPLOMATIC COMMUNICATIONS, ACCESS TO PORTS, FOREIGN POLICY"
filename_1738526840408.pdf,16 APR 1974,AMEMBASSY LA PAZ,SECSTATE WASHDC 2836,ICEM AND OAS MEETING IN ATLANTA,PFOR BL OAS,NA,1974LAPAZ02343,UNCLASSIFIED,30 JUN 2005,"MEETING AGENDA, MEETINGS"
filename_1738526840592.pdf,18 APR 1974,AMEMBASSY LA PAZ,AMEMBASSY LIMA,NA,"EGEN, LAFTA, BL",NA,1974LAPAZ02436,UNCLASSIFIED,30 JUN 2005,"JUNTA, MEETING AGENDA, MEETINGS"
filename_1738526840627.pdf,16 APR 1974,AMEMBASSY LA PAZ,SECSTATE WASHDC IMMEDIATE 2840,NA,"EGEN, LAFTA, PE, VE, BL",CARACAS 3226 AIDAC,1974LAPAZ02347,UNCLASSIFIED,30 JUN 2005,"PRESIDENT, COMMON MARKETS"
filename_1738526841168.pdf,19 APR 1974,AMEMBASSY LA PAZ,AMEMBASSY LIMA,NA,"EFIN, PE, BL, LAFTA",NA,1974LAPAZ02466,UNCLASSIFIED,30 JUN 2005,"MEETING AGENDA, AGREEMENTS, MEETINGS, PROPOSALS (BID)"
filename_1738526841516.pdf,22 APR 1974,AMEMBASSY LA PAZ,SECSTATE WASHDC 2887,NA,"APER, BL, (DOUGLAS, ROBERT)",NA,1974LAPAZ02490,UNCLASSIFIED,30 JUN 2005,n/a
filename_1738526841702.pdf,24 APR 1974,AMEMBASSY LA PAZ,SECSTATE WASHDC 2908,FOREIGN INVESTMENT CLIMATE AND DATA,"EIND, EFIN",STATE 53993 SUMMARY: THUS MESSAGE UPDATES FOREIGN INVESTMENT CLIMATE NARRATIVE FOR ANNUAL COMPENDIUM. END SUMMARY.,1974LAPAZ02576,UNCLASSIFIED,30 JUN 2005,"COMMERCE & INDUSTRY, FOREIGN INVESTMENTS, INVESTMENT OPPORTUNITY REPORTS, INVESTMENT DATA"
filename_1738526842360.pdf,24 APR 1974,AMEMBASSY LA PAZ,SECSTATE WASHDC PRIORITY 2909,NA,PFOR MASS OVIP EAID BL,NA,1974LAPAZ02581,UNCLASSIFIED,30 JUN 2005,"MILITARY ASSISTANCE, ECONOMIC ASSISTANCE, DIPLOMATIC DISCUSSIONS, CHIEF OF STATE VISITS"
filename_1738526842420.pdf,24 APR 1974,AMEMBASSY LA PAZ,SECSTATE WASHDC IMMEDIATE 2921,NA,MASS BL,SEC/DEFENSE MESSAGE 121835Z APR 74,1974LAPAZ02604,UNCLASSIFIED,30 JUN 2005,"MILITARY ASSISTANCE, PRESIDENT, ECONOMIC ASSISTANCE, CREDIT AGREEMENTS"
filename_1738526842628.pdf,24 APR 1974,AMEMBASSY LA PAZ,SECSTATE WASHDC 2924,NA,"ETRD, BL",STATE 44074 (NOTAL),1974LAPAZ02611,UNCLASSIFIED,30 JUN 2005,"TREATY VIOLATION, FARM EQUIPMENT, TRADE AGREEMENTS, TRACTORS, IMPORT CONTROLS, MONOPOLIES"
filename_1738526842783.pdf,24 APR 1974,AMEMBASSY LA PAZ,SECSTATE WASHDC 2907,NA,SGEN OTRA BL,NA,1974LAPAZ02574,UNCLASSIFIED,30 JUN 2005,"DISASTER RELIEF, VISITS, NATURAL DISASTERS, VOLUNTARY AGENCIES"
filename_1738526843247.pdf,25 APR 1974,AMEMBASSY LA PAZ,SECSTATE WASHDC IMMEDIATE 2934,NA,MASS BL,A) LA PAZ 2604 B) SEC/DEFENSE MESSAGE 121835Z APR 74,1974LAPAZ02646,UNCLASSIFIED,30 JUN 2005,"MILITARY ASSISTANCE, CREDIT AGREEMENTS, DIPLOMATIC COMMUNICATIONS"
filename_1738526843976.pdf,26 APR 1974,AMEMBASSY LA PAZ,SECSTATE WASHDC PRIORITY 2952,NA,"EAGR, BEXP, BL",LIMA 3279,1974LAPAZ02673,UNCLASSIFIED,30 JUN 2005,TRADE OPPORTUNITY REPORTS
filename_1738526844204.pdf,26 APR 1974,AMEMBASSY LA PAZ,SECSTATE WASHDC 2940,APPLEGATE-YOUNGQUIST CASE,"BIZCQB, BL",NA,1974LAPAZ02654,UNCLASSIFIED,30 JUN 2005,"DISPUTE SETTLEMENT, LAND NATIONALIZATION, NEGOTIATIONS"
filename_1738526844302.pdf,30 APR 1974,AMEMBASSY LA PAZ,SECSTATE WASHDC 2960,PL 480 - TITLE I WHEAT,"EAID, BL",(A) STATE 20276 (B) STATE 081990,1974LAPAZ02742,UNCLASSIFIED,30 JUN 2005,"WHEAT, PL 480 TITLE 1"
filename_1738526844512.pdf,30 APR 1974,AMEMBASSY LA PAZ,SECSTATE WASHDC 2968,OPIC INSURANCE APPLICATIONS: JOHN LAMAR LESSOR AND CHARLES E. STOKES STATE PASS OPIC SUMMARY. GOB HAS SENT NOTE INDICATING MIN AG'S APPROVAL SUBJECT OPIC INVESTMENT. TELEGRAM DISCUSSES FORM OF NOTE AND COMMENTS ON LAND INVESTMENTS IN BOLIVIA. END SUMMARY.,"EFIN, BL",NA,1974LAPAZ02766,UNCLASSIFIED,30 JUN 2005,"INSURANCE, CATTLE, NATIONALIZATION, INVESTORS, FOREIGN INVESTMENTS, CONTRACTS, LAND REFORMS"
filename_1738526845148.pdf,01 MAY 1974,AMEMBASSY LA PAZ,SECSTATE WASHDC 2976,"TEXTILE TRADE MISSION, VENEZUELA, COLOMBIA, AND BRAZIL, JUNE, 1974","BEXP, BL",NA,1974LAPAZ02773,UNCLASSIFIED,30 JUN 2005,n/a
filename_1738526845282.pdf,07 MAY 1974,AMEMBASSY LA PAZ,SECSTATE WASHDC 3008,EXPORT COMPETITION: LARGE TRACTORS,"BEXP, BL",LA PAZ A87,1974LAPAZ02898,UNCLASSIFIED,30 JUN 2005,n/a
filename_1738526845332.pdf,07 MAY 1974,AMEMBASSY LA PAZ,SECSTATE WASHDC 3014,IMPC/EMBOSA PROBLEM,BDIS BL,STATE 083632 FROM AMBASSADOR,1974LAPAZ02914,UNCLASSIFIED,30 JUN 2005,n/a
filename_1738526845593.pdf,08 MAY 1974,AMEMBASSY LA PAZ,SECSTATE WASHDC 3023,NA,"ETRD, EAGR",NA,1974LAPAZ02935,UNCLASSIFIED,30 JUN 2005,"ECONOMIC GROWTH, DATA, MARKETS, US CONGRESSIONAL HEARINGS, COMMITTEES"
filename_1738526846166.pdf,08 MAY 1974,AMEMBASSY LA PAZ,SECSTATE WASHDC IMMEDIATE 3030,NA,CASC,NA,1974LAPAZ02954,UNCLASSIFIED,30 JUN 2005,n/a
filename_1738526846318.pdf,08 MAY 1974,AMEMBASSY LA PAZ,SECSTATE WASHDC 3025,NA,"ETRD, BL",NA,1974LAPAZ02947,UNCLASSIFIED,30 JUN 2005,"PRESS COMMENTS, IMPORTS, LAW, CUSTOMS DUTIES, TARIFF SCHEDULES, FEES, SALES TAXES"
filename_1738526846411.pdf,08 MAY 1974,AMEMBASSY LA PAZ,SECSTATE WASHDC 3025,NA,"ETRD, BL",NA,1974LAPAZ02047,UNCLASSIFIED,30 JUN 2005,"COMMITTEES, ELECTION CANDIDATES, INTERNATIONAL ORGANIZATIONS"
filename_1738526847154.pdf,09 MAY 1974,AMEMBASSY LA PAZ,DEA HQS WASHDC PRIORITY,"BOLIVIAN TRAINING SCHOOL HQS FOR STUTMAN/TR, EMBASSY FOR DEA","SNAR, BL",NA,1974LAPAZ03003,UNCLASSIFIED,30 JUN 2005,"DRUG CONTROL, PERSONNEL TRAINING, VISITS, PERSONNEL TRAVEL"
filename_1738526847242.pdf,09 MAY 1974,AMEMBASSY LA PAZ,SECSTATE WASHDC PRIORITY 3046,LAB BUYS JET,"EFIN, BL",NA,1974LAPAZ03005,UNCLASSIFIED,30 JUN 2005,"CIVIL AVIATION, AIRLINES, AIRCRAFT SALES, CREDIT AGREEMENTS, BANK LOANS"
filename_1738526848160.pdf,14 MAY 1974,AMEMBASSY LA PAZ,SECSTATE WASHDC 3079,NA,PFOR EAID MASS BL,NA,1974LAPAZ03098,UNCLASSIFIED,30 JUN 2005,"MILITARY ASSISTANCE, ECONOMIC DEVELOPMENT, DIPLOMATIC DISCUSSIONS, FOREIGN ASSISTANCE PROGRAMS, FLOOD"
filename_1738526848329.pdf,10 MAY 1974,AMEMBASSY LA PAZ,SECSTATE WASHDC PRIORITY 3056,BOLIVIA CASP,"PFOR, BL, EAID",A. STATE 88210 B. LA PAZ 2848,1974LAPAZ03038,UNCLASSIFIED,30 JUN 2005,"REPORTS, CASP, AGRICULTURAL PROGRAMS, PERSONNEL TRAVEL, LOANS, FIELD CROPS"
filename_1738526849287.pdf,14 MAY 1974,AMEMBASSY LA PAZ,SECSTATE WASHDC PRIORITY 3088,PL-480 TITLE I LIMA FOR AGATT,"EAID, EAGR, ECON, BL","STATE 092148 AND LA PAZ A-023. SUMMARY: WE ESTIMATE THAT EVEN IF PRESENT COMMERCIAL WHEAT/FLOUR IMPORT ARRANGEMENTS IMPLEMENTED BOLIVIA WILL HAVE SUPPLY GAP OF ABOUT 40,000 M.T. OF WHEAT WHICH SHOULD BE MET BY PL-480. WE BELIEVE FURTHER AGREEMENT JUSTIFIED ON BASIS POOR BALANCE OF PAYMENTS PROSPECTS FOR 1975, AS INTEGRAL ELEMENT USG ASSISTANCE STRATEGY FOR AGRRICULTURE SECTOR AND OTHER DEVELOPMENT SECTORS IN WHICH USG DIRECTING ITS EFFORTS. WE ALSO SEE POSSIBILITY THAT PL-480 GENERATIONS MIGHT BE USED TO HELP FINANCE LOCAL CURRENCY COSTS LATER PHASES RECONSTRUCTION FLOOD DAMAGED AREAS. WE JUDGE PL-480 HAS HIGH GOB PRIORITY, IS POLITICALLY IMPORTANT AND THAT USG HAS RESPONSIBILITY TO USE THIS FLEXIBLE TOOL IN HELPING SOLVE BOLIVIA'S GRAIN SUPPLY PROBLEM AND TO AVOID JOLTING CHANGE FROM SUBSTANTIAL WHEAT CREDIT PROGRAM TO NO WHEAT CREDIT PROGRAM AT ALL. END SUMMARY:",1974LAPAZ03128,UNCLASSIFIED,30 JUN 2005,"WHEAT, DATA, PL 480 TITLE 1, BALANCE OF PAYMENTS DEFICITS, CREDIT AGREEMENTS, FOREIGN ASSISTANCE PROGRAMS,"
filename_1738526849749.pdf,16 MAY 1974,AMEMBASSY LA PAZ,DEA HQS WASHDC,NA,"SNAR, BL",NA,1974LAPAZ03188,UNCLASSIFIED,30 JUN 2005,"DRUG CONTROL, PERSONNEL TRAINING"
filename_1738526849836.pdf,16 MAY 1974,AMEMBASSY LA PAZ,SECSTATE WASHDC 3111,NA,"PINT, BL",NA,1974LAPAZ03187,UNCLASSIFIED,30 JUN 2005,"OPPOSITION PARTIES, PARTY ALLIANCE, PARTY ORGANIZATION"
filename_1738526850161.pdf,16 MAY 1974,AMEMBASSY LA PAZ,SECSTATE WASHDC 3105,EVALUATION OF INTAL PERFORMANCE,"EGEN, LAFTA, BL",STATE 85043,1974LAPAZ03165,UNCLASSIFIED,30 JUN 2005,"INTERNATIONAL LABOR ORGANIZATIONS, SEMINARS, ECONOMIC INTEGRATION"
filename_1738526851749.pdf,22 MAY 1974,AMEMBASSY LA PAZ,SECSTATE WASHDC IMMEDIATE 3163,POLITICAL TENSIONS RISE OVER RELATIONS WITH BRAZIL,"PINS, PINT, PFOR, BL",LA PAZ 3187,1974LAPAZ03295,UNCLASSIFIED,30 JUN 2005,"NATURAL GAS, OPPOSITION PARTIES, PARTY ALLIANCE, CHIEF OF STATE VISITS, CONTRACTS, POPULAR RESENTMENT,"
filename_1738526852097.pdf,22 MAY 1974,AMEMBASSY LA PAZ,SECSTATE WASHDC 3161,AMERICAN INDIAN CONVENTION,BL,STATE 101850,1974LAPAZ03292,UNCLASSIFIED,30 JUN 2005,"MINORITIES, MEETINGS, MEETING DELEGATIONS, FOREIGN POLICY POSITION"
filename_1738526852192.pdf,20 MAY 1974,AMEMBASSY LA PAZ,SECSTATE WASHDC 3141,NA,"TECH, ENRG, BL","STATE A-3772 OF MAY 8, 1974",1974LAPAZ03250,UNCLASSIFIED,30 JUN 2005,"ENRGY, MEETINGS, INVITATIONS"
filename_1738526853280.pdf,23 MAY 1974,AMEMBASSY LA PAZ,SECSTATE WASHDC PRIORITY 3195,NA,"EFIN, BEXP, BL, BR",NA,1974LAPAZ03357,UNCLASSIFIED,30 JUN 2005,"CONSTRUCTION EQUIPMENT, COOPERATIVE SERVICE AGREEMENTS, CREDIT AGREEMENTS, HIGHWAYS"
filename_1738526853739.pdf,23 MAY 1974,AMEMBASSY LA PAZ,SECSTATE WASHDC PRIORITY 3193,"PRESIDENT'S GEISEL AND BANZER SIGN GAS AND INDUSTRIAL DEVELOPMENT ""ACT""","ECON, EFIN, EMIN, ENRG, BL, BR","A-269 OF DECEMBER 12, 1973; A-074 OF APRIL 16, 1974 SUMMARY ""ACT OF COOPERATION AND INDUSTRIAL COMPLE- MENTATION"" WAS SIGNED BY PRESIDENTS GEISEL AND BANZER MAY 22 IN COCHABAMBA. THE ACT IS TO BECOME EFFECTIVE UPON RATIFICATION. COMPLETE TEXT AS PUBLISHED IN NEWSPAPERS BEING SENT BY AIRGRAM TOGETHER WITH OTHER DOCUMENTATION. THIS MESSAGE SUMMARIZES MAIN ELEMENTS OF AGREEMENT WHICH COVERS POSSIBLE GAS SALES TO BRAZIL UNCLASSIFIED UNCLASSIFIED PAGE 02 LA PAZ 03356 01 OF 02 232250Z AND BRAZILIAN ASSISTANCE FOR INDUSTRIAL DEVELOPMENT Declassified/Released US Department of State EO Systematic Review 30 JUN 2005 Declassified/Released US Department of State EO Systematic Review 30 JUN 2005 POLE IN SOUTHEAST BOLIVIA. END SUMMARY.1. ART. 4 IF STUDIES SHOW THEIR TECHNICAL AND ECONOMIC FEASIBILITY (A) BOLIVIAN GOVERNMENT (GOBO) IS COMMITTED TO SELL AVERAGE 240 MILLION CUBIC FEET OF NATURAL GAS TO BRAZIL FOR 20 YEARS ON TERMS AND CONDITIONS (INCLUDING PRICE WHICH CAN BE ADJUSTED EVERY SIX MONTHS IN ACCORDANCE WITH INTERNATIONAL MARKET PRICE) TO BE ESTABLISHED IN CONTRACT BETWEEN PETROLEO BRASILEIRO S.A. (PETROBRAS) AND YACIMIENTOS PETROLIFEROS FISCALES BOLIVIANOS (YPFB); (B) BRAZILIAN GOVERNMENT (GOBR) IS COMMITTED TO COOPERATE IN IMPLEMENTATION OF PROJECTS AND INFRASTRUCTURE NEEDED FOR GAS PIPELINES AND INDUSTRIAL DEVELOPMENT POLE AS SET OUT IN ARTS. 2 AND 3; (C) GOBR IS COMMITTED TO GUARANTEE MARKET FOR PRODUCTS OF BOLIVIAN INDUSTRIAL DEVELOPMENT POLE IN ACCORDANCE WITH TERMS OF ANNEX II OF ACT WHICH SPELLS OUT IN DETAIL PERCENT OF PRODUCTION OF EACH PLANT WHICH BRAZIL AGREES TO TAKE AS MINIMUM AND CUSTOMS AND INTERNAL TAXES THAT WILL APPLY. 2. (ART.3) GOBO WILL PRESENT TO GOBR STUDY ON GAS RESERVES CERTIFYING SUFFICIENT SUPPLIES TO MEET 240 MILLION CUBIC FEET PER DAY FOR 20 YEARS COMMITMENT TO GOBR. GOBO WILL DO STUDIES FOR GAS PIPELINES WITH SUFFICIENT CAPACITY TO SUPPLY BOLIVIAN INDUSTRIES TO BE ESTABLISHED PLUS COMMITMENT TO BRAZIL. GOBR WILL DO STUDIES FOR GAS PIPELINE FROM BORDER TO BRAZILIAN CONSUMPTION POINTS. 3. (ART.2) GOBO AND GOBR WILL COOPERATE TO DO STUDIES FOR (A) STEEL COMPLEX WITH CAPACITY TO PRODUCE ANNUALLY 900,000 M.T. SPONGE IRON AND STEEL AND LAMINATIONS EQUIVALENT TO 500,000 M.T. STEEL; (B) NITROGENOUS FERTILIZER PLANT WITH UREA PRODUCTION CAPACITY OF 1,000 M.T. PER DAY; (C) CEMENT PLANT WITH CAPACITY OF 1,000 M.T. PER DAY AND (D) INFRASTRUCTURE FOR DEVELOPMENT POLE. 4. (ART.1) GOBO AND GOBR AGREE TO CARRY OUT ASAP ESTABLISHMENT OF PLANTS REFEREED TO IN PRECEDING PARA PLUS POWER PLANT. BOLIVIA DISPOSED TO IMPLEMENT (CONCRETAR) GAS SALE TO BRAZIL ""IN CONJUNCTION WITH"" UNCLASSIFIED UNCLASSIFIED PAGE 03 LA PAZ 03356 01 OF 02 232250Z ESTABLISHMENT OF DEVELOPMENT POLE. 5. ART.5 GOBR WILL FINANCE GOBO STUDIES REFERRED TO IN ART. II(PRECEDING PARA) IN AMOUNT UP TO US$ 10 MILLION, 5 PERCENT INTEREST, 3 YEARS GRACE, 15 YEARS TOTAL TERM. LOAN AGREEMENT TO BE SIGNED WITHIN 30 DAYS FROM SIGNING ACT LOAN PROCEEDS FREELY DISPOSABLE AND CONVERTIBLE. 6. (ART 2.) GOBR AND GOBO WILL ESTABLISH BOLIVIAN- Declassified/Released US Department of State EO Systematic Review 30 JUN 2005 Declassified/Released US Department of State EO Systematic Review 30 JUN 2005 BRAZILIAN ECONOMIC AND TECHNICAL COOPERATION COMMITTEE TO COORDINATE IMPLEMENTATION OF ACT. 7. (ART.8) GOBO AND GOBR AGREE TO STUDY IN LATER PHASE ECONOMIC VIABILITY OF PETRO- CHEMICAL COMPLEX FOR PRODUCTION OF ETHYLENE AND ITS DERIVATIVES WITH POSSIBLE GOBR MARKET GUARANTEE. 8. (ANNEX I). GOBR IS COMMITTED TO (A) FINANCE ALL OF GOBO PURCHASES OF BRAZILIAN GOODS AND SERVICES FOR PROJECTS DESCRIBED IN ARTS. II AND III AT INTEREST RATES AND TERMS EQUAL TO BEST GRANTED BY GOBR TO OTHER COUNTRIES AT TIME REQUESTED; (B) GUARANTEE FINANCING OF UP TO HALF OF PURCHASES OF GOODS AND SERVICES GOBO MAY MAKE IN THIRD COUNTRIES FOR PROJECTS DESCRIBED IN ART. II AT INTEREST RATES AND TERMS PREVAILING IN INTERNATIONAL MARKET AT TIME PURCHASE CONTRACTS SIGNED; (C) FINANCE AT GOBO'S REQUEST LOCAL COSTS OF PROJECTS MENTIONED IN ACT IN AMOUNTS AND AT TERMS AND CONDITIONS TO BE ESTABLISHED; (D) COOPERATE WITH GOBO IN OBTAINING RESOURCES NEEDED FROM IFI'S SUCH AS IDB AND IBRD FOR FINANCING BOLIVIAN PORTION GAS PIPELINES. BREWIN UNCLASSIFIED NNN UNCLASSIFIED PAGE 01 LA PAZ 03356 02 OF 02 232254Z 64 ACTION ARA-20 INFO OCT-01 ISO-00 FPC-01 AEC-11 AID-20 CEA-02 CIAE-00 CIEP-02 COME-00 DODE-00 EB-11 FEA-02 H-03 INR-10 INT-08 L-03 NSAE-00 NSC-07 OMB-01 PM-07 RSC-01 SAM-01 SCI-06 SP-03 SS-20 STR-08 TRSE-00 PA-04 PRS-01 USIA-15 AGR-20 XMB-07 DRC-01 /196 W --------------------- 018356 P R 232105Z MAY 74 FM AMEMBASSY LA PAZ TO SECSTATE WASHDC PRIORITY 3194 INFO AMEMBASSY BRASILIA Declassified/Released US Department of State EO Systematic Review 30 JUN 2005 Declassified/Released US Department of State EO Systematic Review 30 JUN 2005 AMEMBASSY BUENOS AIRES AMEMBASSY LIMA AMEMBASSY SANTIAGO AMEMBASSY ASUNCION AMEMBASSY BOGOTA AMEMBASSY CARACAS AMEMBASSY QUITO UNCLAS SECTION 2 OF 2 LA PAZ 3356/2 9. (ANNEX II) PERCENTAGES OF PRODUCTION FROM DEVELOPMENT POLE THAT GOBR GUARANTEES TO TAKE AS MINIMUM ARE SET OUT IN DETAIL. SUPPLY OF GAS TO BRAZIL WILL DEPEND ON CONCLUSION OF ALL STUDIES; FEASIBILITY OF PROJECTS; SIGNING OF MARKET GUARANTEE, PRICE, FINANCING, AND TECHNICAL ASSISTANCE CONTRACTS AND COMPLETION OF GAS PIPELINE. IRON AND STEEL PRICES WILL BE SET FOLLOWING COMPLETION FEASIBILITY STUDIES AND ON BASIS COMPETITIVENESS IN BRAZILIAN MARKET. FERTILIZER PRICE AT CORUMBA WILL BE EQUIVALENT TO CIF PRICE SANTOS UREA IMPORTED FROM THIRD COUNTRIES. GAS PRICE WILL BE ESTABLISHED IN PETROBRAS-YPFB CONTRACT. UNCLASSIFIED UNCLASSIFIED PAGE 02 LA PAZ 03356 02 OF 02 232254Z 10. (ANNEX III) GOBR WILL PROVIDE TECHNICAL ASSISTANCE AT REQUEST GOBO FOR IMPLEMENTATION INDUSTRIAL PROJECTS MENTIONED IN ACT WITHIN TERMS BASIC AGREEMENT OF JULY 10, 1973 (SEE REFAIR) AND IN ACCORDANCE WITH FURTHER GUIDELINES SET OUR IN ANNEX III.",1974LAPAZ03356,UNCLASSIFIED,30 JUN 2005,"NATURAL GAS, INDUSTRIAL DEVELOPMENT, TREATY SIGNATURE, DEVELOPMENT PROGRAMS, TECHNICAL ASSISTANCE"
filename_1738526854639.pdf,24 MAY 1974,AMEMBASSY LA PAZ,SECSTATE WASHDC 3202,NA,"EAID, ECON, BL",NA,1974LAPAZ03382,UNCLASSIFIED,30 JUN 2005,"MEETINGS, MEETING DELEGATIONS"
filename_1738526854806.pdf,28 MAY 1974,AMEMBASSY LA PAZ,SECSTATE WASHD PRIORITY 3217,NA,"MASS, BL",STATE 110568 AND PREVIOUS,1974LAPAZ03430,UNCLASSIFIED,30 JUN 2005,"PROCUREMENT, MILITARY ASSISTANCE, MILITARY EQUIPMENT, DATA, TANKS (COMBAT VEHICLES), MILITARY SALES"
filename_1738526854981.pdf,29 MAY 1974,AMEMBASSY LA PAZ,SECSTATE WASHDC 3224,NA,AFIN: SEPARATION,NA,1974LAPAZ03446,UNCLASSIFIED,30 JUN 2005,n/a
filename_1738526855475.pdf,29 MAY 1974,AMEMBASSY LA PAZ,SECSTATE WASHDC 3232,NA,"EAGR, SPOP, BL",STATE 107507,1974LAPAZ03463,UNCLASSIFIED,30 JUN 2005,"POPULATION, PRIVATE ENTERPRISE, COMMITTEE MEETINGS, INTERGOVERNMENTAL COOPERATION, FOOD ASSISTANCE"
filename_1738526855516.pdf,30 MAY 1974,AMEMBASSY LA PAZ,SECSTATE WASHDC 3253,BOLIVIAN DELEGATION TO THIRD UN CONFERENCE ON LAW OF THE SEA,"PBOR, UN, BL, PINR",STATE 67788; LA PAZ 1791; LA PAZ 1617,1974LAPAZ03507,UNCLASSIFIED,30 JUN 2005,"LAW OF THE SEA, SEABED, BIOGRAPHIC INFORMATION, NEGOTIATIONS, MEETINGS, MEETING DELEGATIONS, FOREIGN"
filename_1738526855710.pdf,30 MAY 1974,AMEMBASSY LA PAZ,SECSTATE WASHDC 3250,NA,"PINT, BL",LA PAZ 3295: LA PAZ A-70,1974LAPAZ03504,UNCLASSIFIED,30 JUN 2005,"LAW, DISPUTES, UNIVERSITIES, POLITICAL PARTIES, POLITICAL SITUATION, STUDENT DEMONSTRATIONS, MEETINGS,"
filename_1738526856770.pdf,30 MAY 1974,AMEMBASSY LA PAZ,SECSTATE WASHDC 3248,MFM WORKING GROUP ON TRANSNATIONAL ENTERPRISES,"PFOR, EGEN, MFM",(A) STATE 111288 (B) STATE 092124,1974LAPAZ03501,UNCLASSIFIED,30 JUN 2005,"FOREIGN MINISTERS MEETINGS, COMMITTEE MEETINGS, WASHINGTON, REGIONAL ORGANIZATIONS"
filename_1738526856904.pdf,30 MAY 1974,AMEMBASSY LA PAZ,SECSTATE WASHDC 3257,NA,"ENRG, BL","A-071 OF APRIL 19, 1974",1974LAPAZ03512,UNCLASSIFIED,30 JUN 2005,"EXPLORATION, PETROLEUM PRODUCTION, NATURAL GAS, TREATY SIGNATURE, CONTRACTS"
filename_1738526857043.pdf,30 MAY 1974,AMEMBASSY LA PAZ,SECSTATE WASHDC IMMEDIATE 3237,NA,"CASC, BL, (ROELLE, DANIEL)",STATE 111090 AND LA PAZ 2771,1974LAPAZ03478,UNCLASSIFIED,30 JUN 2005,n/a
filename_1738526857381.pdf,31 MAY 1974,AMEMBASSY LA PAZ,SECSTATE WASHDC IMMEDIATE 3269,NA,"PINT, PGOV, BL",LA PAZ 3504: LA PAZ 3295,1974LAPAZ03550,UNCLASSIFIED,30 JUN 2005,"GOVERNMENT REFORM, POLITICAL STABILITY, NATIONAL SECURITY, PRESIDENT, GOVERNMENT OVERTHROW,"
filename_1738526857878.pdf,31 MAY 1974,AMEMBASSY LA PAZ,SECSTATE WASHDC 3268,SHORT RANGE DEVELOPMENT PLANS AND GAS RESERVES,"ENRG, BL","A-110 OF MAY 31, 1974",1974LAPAZ03545,UNCLASSIFIED,30 JUN 2005,"GAS RESERVES, PROPOSALS (BID), CONTRACTS, EXPLORATORY DRILLING, OIL FIELDS, PETROLEUM CONCESSIONS,"
filename_1738526858050.pdf,31 MAY 1974,AMEMBASSY LA PAZ,SECSTATE WASHDC 3263,"BOLIVIA INVITED TO ATTEND JUNE, 1974 OPEC CONFERENCE","ENRG, BL",NA,1974LAPAZ03433,UNCLASSIFIED,30 JUN 2005,"PRESS COMMENTS, MEMBERSHIP, PETROLEUM, ECONOMIC CONDITIONS, INVITATIONS, MEETINGS, MEETING OBSERVERS"
filename_1738526858255.pdf,05 JUN 1974,AMEMBASSY LA PAZ,SECSTATE WASHDC 3300,BOLIVIAN OFFICIALS RESPONSIBLE FOR EASTERN DEVELOPMENT ZONE AND RELATED MATTERS,"BEXP, BMEP, ENRG, EMIN, BL",LA PAZ 3356; A-110; STATE 115983,1974LAPAZ03612,UNCLASSIFIED,30 JUN 2005,"DEVELOPMENT PROGRAMS, TECHNICAL ASSISTANCE CONTRACTS, MINING INDUSTRY, GOVERNMENT PERSONNEL"
filename_1738526858564.pdf,05 JUN 1974,AMEMBASSY LA PAZ,SECSTATE WASHDC 3314,NA,BDIS BL,"(A) LA PAZ 3396; (B) STATE 83632 BEGIN SUMMARY: AT REQEUST OF MINCOORDINATION, CHARGE AND ADCM CALLED ON MINMINING ON JUNE 4, PRESENTING POINTS PREVIOUSLY SUBMITTED TO MINCOORDINATPON CONTAINED REF (B) AND REQUESTED ARBITRATION OR SIMILAR PROCEEDING. AFTER REVIEWING CASE MINMINING STATED THAT THERE WAS NO BASIS FOR ANY CONCEIVABLE CLAIM OR DEMAND TYE MIGHT HAVE IN MIND OR FOR ARBITRATION. END SUMMARY.",1974LAPAZ03641,UNCLASSIFIED,30 JUN 2005,n/a
filename_1738526858914.pdf,06 JUN 1974,AMEMBASSY LA PAZ,SECSTATE WASHDC PRIORITY 3332,NA,"PINT, PGOV, BL",NA,1974LAPAZ03687,UNCLASSIFIED,30 JUN 2005,"PRESIDENT, GOVERNMENT REFORM, POLITICAL STABILITY, ARMED FORCES, SPEECHES, PUBLIC ADMINISTRATION,"
filename_1738526859039.pdf,07 JUN 1974,AMEMBASSY LA PAZ,SECSTATE WASHDC PRIORITY 3345,ARMED FORCES DISMISS TWENTY-FOUR OFFICERS,"PINT, PGOV, BL",NA,1974LAPAZ03715,UNCLASSIFIED,30 JUN 2005,"ARMED FORCES, MILITARY PERSONNEL, GOVERNMENT REFORM, PERSONNEL SEPARATIONS, COMMUNIQUES, OPPOSITION"
filename_1738526859375.pdf,07 JUN 1974,AMEMBASSY LA PAZ,SECSTATE WASHDC 3352,NA,"EAID, BL",NA,1974LAPAZ03729,UNCLASSIFIED,30 JUN 2005,"AGREEMENTS, PL 480 TITLE 1, FOREIGN EXCHANGE TRANSACTIONS, DEBT REPAYMENTS, CHECKS (MONEY)"
