source_file,cable_date,cable_from,cable_to,cable_subject,cable_tags,cable_ref,doc_number,classification,declass_date,concepts
filename_1738525613702.pdf,29 dec 1979,AMEMBASSY LA PAZ,SECSTATE WASHDC IMMEDIATE 9949,BOLIVIAN GOVERNMENT SIGNS IMF LETTER OF INTENT,"EFIN, BL","(A) LA PAZ 10725, (B) LA PAZ 10745, (C) STATE 330263",1979LAPAZ10988,UNCLASSIFIED,20 Mar 2014,"FINANCIAL AGREEMENTS, IMF DRAWING RIGHTS, FINANCIAL PROGRAMS"
filename_1738525614293.pdf,17 feb 1979,AMEMBASSY LA PAZ,SECSTATE WASHDC 4842,"(C) ECONOMIC STABILIZATION MEASURES BY GOB UNLIKELY, BUT A FINANCIAL CRISIS SHOULD BE AVOIDABLE","EGEN, EFIN, BL",NA,1979LAPAZ01469,UNCLASSIFIED,20 Mar 2014,FINANCIAL CRISIS
filename_1738525614334.pdf,02 jul 1979,AMEMBASSY LA PAZ,SECSTATE WASHDC NIACT IMMEDIATE 0000,ELECTION DAY IMPRESSIONS,"PINT, BL",NA,1979LAPAZ05655,UNCLASSIFIED,20 Mar 2014,ELECTION RESULTS
filename_1738525615457.pdf,24 apr 1979,AMEMBASSY LA PAZ,SECSTATE WASHDC PRIORITY 5899,ECLA PLENARY CONFERENCE: COMMITTEE II (INSTITUTIONAL ISSUES/PROGRAM OF WORK),"OCON, ECLA, UN",LA PAZ 3493,1979LAPAZ03561,UNCLASSIFIED,20 Mar 2014,n/a
filename_1738525615508.pdf,19 apr 1979,AMEMBASSY LA PAZ,SECSTATE WASHDC 5816,(C) POLITICAL TRENDS: FIRST QUARTER 1979,"PINT, BL",NA,1979LAPAZ03402,UNCLASSIFIED,20 Mar 2014,"POLITICAL STABILITY, TRENDS, POLITICAL SITUATION"
filename_1738525616570.pdf,31 aug 1979,AMEMBASSY LA PAZ,SECSTATE WASHDC IMMEDIATE 7997,BANZER GOES ON TRIAL BEFORE CONGRESS,"POINT, BL",NA,1979LAPAZ07472,UNCLASSIFIED,20 Mar 2014,"TREASON TRIALS, CENTRAL LEGISLATURE, POLITICAL LEADERS, COURT PROCEEDINGS"
filename_1738525727858.pdf,26 dec 1979,SECSTATE WASHDC,AMEMBASSY LA PAZ,1979 BOLIVIA HUMAN RIGHTS REPORT,"SHUM, BL",NA,1979STATE331361,UNCLASSIFIED,20 Mar 2014,"HUMAN RIGHTS, REPORTS"
filename_1738525727867.pdf,15 nov 1979,AMEMBASSY SAN JOSE,SECSTATE WASHDC 6707,NA,"PINT, PEPR, PORG, BL",SAN JOSE 5164 (NOTAL),1979SANJO05291,UNCLASSIFIED,20 Mar 2014,"GOVERNMENT OVERTHROW, JUNTA, PRESS RELEASES, POLITICAL PARTIES"
filename_1738525728687.pdf,02 nov 1979,SECSTATE WASHDC,USDEL SECRETARY IMMEDIATE,"DAILY PRESS BRIEFING, NOVEMBER 1, 1979","SOPN, OVIP (VANCE, CYRUS R.)",NA,1979STATE286983,UNCLASSIFIED,20 Mar 2014,"PUBLIC DEMONSTRATIONS, GOVERNMENT OVERTHROW, TOSEC, PRESS SUMMARIES, POLITICAL SITUATION, STUDENTS,"
filename_1738525728705.pdf,14 dec 1979,SECSTATE WASHDC,AMEMBASSY LA PAZ PRIORITY,CONVERSATION BETWEEN WALTER GUEVARA ARZE AND ASSISTANT SECRETARY VAKY,"PINT, BL",NA,1979STATE322132,UNCLASSIFIED,20 Mar 2014,"DIPLOMATIC DISCUSSIONS, POLITICAL SITUATION, TRENDS"
filename_1738526026117 Boeker Natusch 3Aug1978.pdf,03 aug 1978,AMEMBASSY LA PAZ,SECSTATE WASHDC IMMEDIATE 1973,PEREDA MAKING HEADWAY ON HIS ELECTION PLAN,PINT BL,"LA PAZ 6172, LA PAZ 6107",1978LAPAZ06188,UNCLASSIFIED,20 Mar 2014,"GOVERNMENT REFORM, REPORTS, NATIONAL ELECTIONS, CAT-B"
filename_1738526026117 Boeker Natusch Aug1978.pdf,01 aug 1978,AMEMBASSY LA PAZ,SECSTATE WASHDC IMMEDIATE 1935,PEREDA'S PLANS,"PINT, BL",STATE 193264,1978LAPAZ06107,UNCLASSIFIED,20 Mar 2014,"GOVERNMENT REFORM, POLICIES, MEETINGS, NATIONAL ELECTIONS, MEETING REPORTS, CAT-B"
filename_1738526783197.pdf,02 JAN 1974,AMEMBASSY LA PAZ,SECSTATE WASHDC IMMEDIATE 1844,NA,"EAID, BL","LA PAZ 7697 SUMMARY: MININD/COM PEREDA CALLED AMBASSADOR TO MINISTRY JANUARY 2 AND MADE STRONG PLEA FOR NEW PL-480 AGREEMENT AND FOR WHEAT ARRIVALS TO TAKE CARE OF SHORTAGES EXPECTED AFTER MARCH 1974. ACTION REQUESTED: ADVISE STATUS OF GOB REQUEST FOR NEW PL-480 AGREEMENT (SEE LA PAZ 5021 OF AUGUST 16, 1973, AND SUBSEQUENT.)",1974LAPAZ00015,UNCLASSIFIED,30 JUN 2005,"FOOD SHORTAGE, WHEAT, AGRICULTURAL AGREEMENTS, PL 480 TITLE 1, NEGOTIATIONS"
filename_1738526784004.pdf,03 JAN 1974,AMEMBASSY LA PAZ,USDOC WASHDC PRIORITY,NA,BEXP ENRG BL,NA,1974LAPAZ00039,UNCLASSIFIED,30 JUN 2005,n/a
filename_1738526784163.pdf,04 JAN 1974,AMEMBASSY LA PAZ,SECSTATE WASHDC 1871,NA,MASS BL,NA,1974LAPAZ00080,UNCLASSIFIED,30 JUN 2005,"MILITARY SALES, NAVAL SHIPS, DIPLOMATIC COMMUNICATIONS, MILITARY CREDIT, MILITARY ASSISTANCE AGREEMENTS"
filename_1738526784271.pdf,04 JAN 1974,AMEMBASSY LA PAZ,USDOC WASHDC,NA,BEXP EIND BL,NA,1974LAPAZ00060,UNCLASSIFIED,30 JUN 2005,n/a
filename_1738526785214.pdf,09 JAN 1974,AMEMBASSY LA PAZ,SECSTATE WASHDC IMMEDIATE 1882,NA,EAID EEC BL,US MISSION EC BRUSSELS 0086,1974LAPAZ00146,UNCLASSIFIED,30 JUN 2005,"WHEAT, FOOD SHORTAGE, FOOD ASSISTANCE, IMPORT QUOTAS, FLOUR, CONTRABAND, PL 480 TITLE 1"
filename_1738526785247.pdf,09 JAN 1974,AMEMBASSY LA PAZ,USDOC WASHDC PRIORITY,SPECIAL TRADE OPPORTUNITY: PETROLEUM REFINERIES - FOLLOW-UP,"BEXP, ETRD, ENRG, EFIN, BL, JA","A-62 APRIL 6, 1973 AND LA PAZ 0039 (NOTAL)",1974LAPAZ00172,UNCLASSIFIED,30 JUN 2005,"PETROLEUM, CONSTRUCTION, REFINERIES, PROPOSALS (BID), LOANS, NEGOTIATIONS, EXPORT DATA"
filename_1738526785306.pdf,09 JAN 1974,AMEMBASSY LA PAZ,USIA WASHDC,NA,"OEXC, SNAR, EC",NA,1974LAPAZ00162,UNCLASSIFIED,30 JUN 2005,"PERSONNEL TRAINING, DRUG CONTROL, MEETINGS"
filename_1738526785670.pdf,09 JAN 1974,AMEMBASSY LA PAZ,SECSTATE WASHDC IMMEDIATE 1888,NA,PINT BL,LA PAZ 110,1974LAPAZ00158,UNCLASSIFIED,30 JUN 2005,"EXILES, ANARCHY, SOCIAL CHANGE, CIVIL DISORDERS, EXTORTION, COMMUNIQUES, PARTY MEETINGS, PARTY LEADERS,"
filename_1738526786757.pdf,09 JAN 1974,AMEMBASSY LA PAZ,SECSTATE WASHDC IMMEDIATE 1073,NA,EAID BL,LA PAZ 15,1974LAPAZ00173,UNCLASSIFIED,30 JUN 2005,"FOOD SHORTAGE, WHEAT, AGRICULTURAL AGREEMENTS, PL 480 TITLE 1, NEGOTIATIONS"
filename_1738526786935.pdf,09 JAN 1974,AMEMBASSY LA PAZ,SECSTATE WASHDC NIACT IMMEDIATE 1887,NA,"EAID,",(A) LA PAZ 2698; (B) STATE 195756,1974LAPAZ00156,UNCLASSIFIED,30 JUN 2005,"WHEAT, PL 480 TITLE 1, FLOUR, TRADE AGREEMENTS, PROPOSALS (BID)"
filename_1738526786979.pdf,10 JAN 1974,AMEMBASSY LA PAZ,SECSTATE WASHDC 1897,NA,OREP PFOR PINS EAID BL,NA,1974LAPAZ00179,UNCLASSIFIED,30 JUN 2005,"WHEAT, CODELS, MEETINGS, MEETING REPORTS, FOREIGN POLICY POSITION, FOREIGN MINISTERS MEETINGS, FOREIGN"
filename_1738526787920.pdf,10 JAN 1974,AMEMBASSY LA PAZ,SECSTATE WASHDC 1910,NA,"OREP, PFOR, PINS, EAID, BL","LA PAZ 0179 SUMMARY: DURING COURTESY CALL BY CONGRESSMAN CHARLES WHALEN, JR., (R-OHIO) JANUARY 10, PRESIDENT BANZER EXPLAINED EXPULSION OF VICTOR PAZ AND DISUCSSED BOLIVIA'S ECONOMIC PROSPECTS, NARCOTICS AND U.S. ASSISTANCE PROGRAM. END SUMMARY.",1974LAPAZ00206,UNCLASSIFIED,30 JUN 2005,n/a
filename_1738526788026.pdf,11 JAN 1974,AMEMBASSY LA PAZ,SECSTATE WASHDC IMMEDIATE 1928,PL-480 TITLE I PROGRAM REFERENCE: STATE 5916,"EAID, BL",NA,1974LAPAZ00244,UNCLASSIFIED,30 JUN 2005,"WHEAT, PL 480 TITLE 1, FLOUR, FOREIGN ASSISTANCE PROGRAMS"
filename_1738526788108.pdf,11 JAN 1974,AMEMBASSY LA PAZ,SECSTATE WASHDC 1918,NA,EMIN EIND BL,"STATE 848 SUMMARY: DUE DELAY, WE TRANSMITTING BELOW FREE TRANSLATION LETTER DATED DECEMBER 14, 1973 FROM FRANK TYE TO MINMINES LEMA. EMBASSY RECEIVED COPY DECEMBER 27, BUT DELAYED TRANSMITTAL WITH COMMENT IN ABSENCE MINATTACHE. END SUMMARY.",1974LAPAZ00225,UNCLASSIFIED,30 JUN 2005,"NATIONALIZATION, MINING INDUSTRY, INDEMNIFICATION"
filename_1738526788819.pdf,12 JAN 1974,AMEMBASSY LA PAZ,SECSTATE WASHDC IMMEDIATE 1929,NA,EAID BL,STATE 5919,1974LAPAZ00246,UNCLASSIFIED,30 JUN 2005,"WHEAT, SUPPLIES, EXPORTS, CREDIT, PL 480 TITLE 1, FOREIGN ASSISTANCE"
filename_1738526789578.pdf,14 JAN 1974,AMEMBASSY LA PAZ,SECSTATE WASHDC 1931,NA,"EMIN, BEXP, BL BR","A-269 OF OCTOBER 14, 1973: STATE 00498#",1974LAPAZ00258,UNCLASSIFIED,30 JUN 2005,n/a
filename_1738526789788.pdf,16 JAN 1974,AMEMBASSY LA PAZ,SECSTATE WASHDC 1951,NA,"BEXP, AFSP, BL",NA,1974LAPAZ00304,UNCLASSIFIED,30 JUN 2005,n/a
filename_1738526790385.pdf,16 JAN 1974,AMEMBASSY LA PAZ,SECSTATE WASHDC PRIORITY 1956,NA,"EAGR, ETRD, BL",NA,1974LAPAZ00321,UNCLASSIFIED,30 JUN 2005,"WHEAT, SUPPLIES, PL 480 TITLE 1, AGRICULTURAL PRODUCT SALES, AGRICULTURAL PRICES, AGRICULTURAL AGREEMENTS"
filename_1738526791079.pdf,16 JAN 1974,AMEMBASSY LA PAZ,SECSTATE WASHDC 1947,NA,OREP EIND ENRG BL,NA,1974LAPAZ00293,UNCLASSIFIED,30 JUN 2005,"PETROLEUM, MINISTERIAL MEETINGS, EMBARGOES, PRICE TRENDS, HYDROELECTRIC POWER PLANTS"
filename_1738526791829.pdf,21 JAN 1974,AMEMBASSY LA PAZ,SECSTATE WASHDC 2005,NA,ECON BL,NA,1974LAPAZ00430,UNCLASSIFIED,30 JUN 2005,"FOOD SHORTAGE, WHEAT, INFLATION, IMPORTS, ECONOMIC PROGRAMS, SUBSIDIES, PRICE TRENDS, RETAIL PRICES, WAGE"
filename_1738526791999.pdf,16 JAN 1974,AMEMBASSY LA PAZ,SECSTATE WASHDC 1946,NA,"EAID, BL","LA PAZ 0246, AND LA PAZ 244 SUMMARY: BOLIVIA CURRENTLY EXPERIENCING SERIOUS FLOUR SHORTAGE WITH SERIOUS POLITICAL IMPLICATIONS FOR GOVERNMENT. ALTHOUGH PRECISE REASONS FOR CURRENT PROBLEM DIFFICULT TO UNTANGLE, BASIC CAUSE APPEARS TO BE FAILURE OF ARGENTINA TO FULFILL COMMITMENTS FOR FLOUR DELIVERIES. THIS HAS BEEN COUPLED IN RECENT WEEKS WITH GREATER THAN USUAL TRANSPORTATION DIFFICULTIES FROM PORTS, ESPECIALLY PERUVIAN RAIL STRIKE WHICH SLOWED MOVEMENT OF PL-480 WHEAT FROM MATARANI. SITUATION MAY IMPROVE THIS WEEK AS RAILROADS NOW MOVING WHEAT AT NORMAL PACE AND SMALL QUANTITY OF FOUR DUE TO ARRIVE FROM ARGENTINA, BUT SHORTAGES LIKELY TO REAPPEAR SINCE STOCKS WILL CONTINUE LOW AND SCARCITIES HAVE INDUCED SPECULATION AND CREATION BLACK MARKET. END SUMMARY.",1974LAPAZ00292,UNCLASSIFIED,30 JUN 2005,"FOOD SHORTAGE, AGREEMENTS, PUBLIC DEMONSTRATIONS, FLOUR, FOREIGN COMMITMENTS, BLACK MARKETS,"
filename_1738526792249.pdf,22 JAN 1974,AMEMBASSY LA PAZ,SECSTATE WASHDC 2017,NA,"CASC (PEGUES, MICKEY)",NA,1974LAPAZ00457,UNCLASSIFIED,30 JUN 2005,n/a
filename_1738526793247.pdf,24 JAN 1974,AMEMBASSY LA PAZ,SECSTATE WASHDC 2042,NA,EAID ECON PFOR BL,NA,1974LAPAZ00526,UNCLASSIFIED,30 JUN 2005,"WHEAT, PROCUREMENT, FOOD SHORTAGE, PUBLIC DEMONSTRATIONS, ECONOMIC ASSISTANCE, PL 480 TITLE 1,"
filename_1738526793783.pdf,24 JAN 1974,AMEMBASSY LA PAZ,SECSTATE WASHDC PRIORITY 2039,NA,"ENRG, ECRP, BL","STATE 251108: A-62 OF APRIL 6, 1973",1974LAPAZ00521,UNCLASSIFIED,30 JUN 2005,"PETROLEUM PRODUCTS, TRADE DATA, EXPORT DATA, IMPORT DATA"
filename_1738526793804.pdf,22 JAN 1974,AMEMBASSY LA PAZ,SECSTATE WASHDC 2015,NA,"CASC (PEGUES, MICKEY)",NA,1974LAPAZ00459,UNCLASSIFIED,30 JUN 2005,n/a
filename_1738526794036.pdf,24 JAN 1974,AMEMBASSY LA PAZ,SECSTATE WASHDC PRIORITY 2026,NA,"ECON, BL",LA PAZ 0430 SUMMARY: GOB SEEKING TO PROMOTE ACCEPTANCE OF ECONOMIC MEASURES DECREED EVENING JANUARY 20. MINISTERS OF FINANCE AND IND/COM HELD JOINT RADIO/TV INTERVIEW JANUARY 21 AND FINANCE MINISTER AND MINISTER SECRETARY AND MINISTER OF TRANSPORTATION GAVE OTHER RADIO/TV INTERVIEWS JANUARY 22 ATTEMPTING TO ASSURE POPULACE THAT STEPS TAKEN NECESSARY TO ELIMINATE SHORTAGES AND THAT THEY ARE SUFFICIENT AND FURTHER PRICE INCREASES SHOULD NOT BE ANTICIPATED. SUB-SECRETARY OF COMMERCE TOLD EMBOFF THAT HE ESTIMATES FOOD SUPPLIES MUST BE REGULARIZED IN NEXT TEN DAYS OR PUBLIC CONFIDENCE WILL BE LOST AND MEASRES WILL PROVE INEFFECTIVE. END SUMMARY.,1974LAPAZ00493,UNCLASSIFIED,30 JUN 2005,"CONTRABAND, DEVALUATIONS, ECONOMIC PROGRAMS, EXPORTS, FOOD SHORTAGE, IMPORTS, PRESS COMMENTS, PRESS"
filename_1738526795005.pdf,25 JAN 1974,AMEMBASSY LA PAZ,SECSTATE WASHDC PRIORITY 2055,NA,"EMIN, BDIS, BL.","LA PAZ 0359, STATE 14198.",1974LAPAZ00548,UNCLASSIFIED,30 JUN 2005,"TIN, LAND, MEETINGS, MINING INDUSTRY, JOINT VENTURES, NEGOTIATIONS, TAXES"
filename_1738526795019.pdf,25 JAN 1974,AMEMBASSY LA PAZ,SECSTATE WASHDC PRIORITY 2046,NA,"BDIS, EIND, BBAK, BL","A) STATE 14854; B) LA PAZ 470; C) STATE 13866; D) BINNS' MEMO OF JAN. 3, 1974",1974LAPAZ00538,UNCLASSIFIED,30 JUN 2005,"FINANCIAL TRANSACTIONS, LOANS"
filename_1738526795093.pdf,24 JAN 1974,AMEMBASSY LA PAZ,AMEMBASSY LIMA,NA,"EAGR, ETRD, BL",NA,1974LAPAZ00497,UNCLASSIFIED,30 JUN 2005,"WHEAT, SALES"
filename_1738526795261.pdf,25 JAN 1974,AMEMBASSY LA PAZ,SECSTATE WASHDC IMMEDIATE 2053,NA,"EAID, EEC, BL",EC BRUSSELS 0459,1974LAPAZ00547,UNCLASSIFIED,30 JUN 2005,"WHEAT, IMPORT DATA, FOOD ASSISTANCE"
filename_1738526795964.pdf,29 JAN 1974,AMEMBASSY LA PAZ,SECSTATE WASHDC IMMEDIATE 2091,NA,"PINS, BL",USDAO LA PAZ MSG 242015Z,1974LAPAZ00612,UNCLASSIFIED,30 JUN 2005,"ARMED FORCES, PRESIDENT, ECONOMIC CONDITIONS, PRESS COMMENTS, GOVERNMENT OVERTHROW, PRICE TRENDS,"
filename_1738526796029.pdf,29 JAN 1974,AMEMBASSY LA PAZ,SECSTATE WASHDC 2085,NA,"CVIS, BL","STATE 117711 TITLE: CONSOLIDATED CONSULAR WORKLOAD AND MANPOWER REQUIREMENTS ESTIMATES FY 1973, 1974 AND 1975 POST: AMERICAN EMBASSY, LA PAZ, BOLIVIA JAN 28, 1974 FY 73 FY 74 *6 75 (ACTUAL (PROJ. (PROJ. WKLD) WKLD) WKLD) PART I - IMMIGRANT VISAS",1974LAPAZ00601,UNCLASSIFIED,30 JUN 2005,n/a
filename_1738526796710.pdf,29 JAN 1974,AMEMBASSY LA PAZ,SECSTATE WASHDC 2088,NA,"BEXP, BL",NA,1974LAPAZ00604,UNCLASSIFIED,30 JUN 2005,n/a
filename_1738526796798.pdf,29 JAN 1974,AMEMBASSY LA PAZ,SECSTATE WASHDC 2081,STATE OF SIEGE DECREE,"PINT, PGOV, BL",NA,1974LAPAZ00600,UNCLASSIFIED,30 JUN 2005,"MARTIAL LAW, GOVERNMENT OVERTHROW, PUBLIC DEMONSTRATIONS, SECURITY CONTROLS, PROVINCIAL GOVERNMENT,"
filename_1738526797122.pdf,29 JAN 1974,AMEMBASSY LA PAZ,SECSTATE WASHDC PRIORITY 2079,NA,"BDIS, EMIN, BL",NA,1974LAPAZ00590,UNCLASSIFIED,30 JUN 2005,"NATIONALIZATION, ARBITRATION, MINING INDUSTRY, INDEMNIFICATION, INDUSTRIAL PLANTS, METAL PRODUCTS"
filename_1738526797312.pdf,30 JAN 1974,AMEMBASSY LA PAZ,SECSTATE WSHDC 2099,PRESIDENT BANZER'S SPEECH ANNOUNCING STATE OF SIEGE,"PINT, PGON, BL",NA,1974LAPAZ00627,UNCLASSIFIED,30 JUN 2005,"PRESIDENT, MARTIAL LAW, GOVERNMENT OVERTHROW, FOOD SHORTAGE, SPEECHES, ECONOMIC CONTROLS, CIVIL"
filename_1738526797805.pdf,31 JAN 1974,AMEMBASSY LA PAZ,SECSTATE WASHDC IMMEDIATE 2122,NA,PFOR MASS BL,LA PAZ 638 BINNS/AMBASSADOR TELECON JAN 31,1974LAPAZ00673,UNCLASSIFIED,30 JUN 2005,"MILITARY EQUIPMENT, MILITARY ASSISTANCE, ARMS, AMMUNITION, GOVERNMENT PROCUREMENT, MILITARY AIRLIFTS,"
filename_1738526798001.pdf,31 JAN 1974,AMEMBASSY LA PAZ,SECSTATE WASHDC IMMEDIATE 2125,NA,n/a,NA,1974LAPAZ00676,UNCLASSIFIED,30 JUN 2005,n/a
filename_1738526798283.pdf,31 JAN 1974,AMEMBASSY LA PAZ,SECSTATE WASHDC PRIORITY 2123,NA,PINT: PGOV: BL,NA,1974LAPAZ00674,UNCLASSIFIED,30 JUN 2005,"MARTIAL LAW, GOVERNMENT OVERTHROW, SECURITY CONTROLS, CURFEW, TRAVEL CONTROLS, CIVIL DISORDERS,"
filename_1738526798463.pdf,01 FEB 1974,AMEMBASSY LA PAZ,SECSTATE WASHDC 2134,NA,"BDIS, EIND, BBAK, BL.",LA PAZ 0577 AND PREVIOUS.,1974LAPAZ00689,UNCLASSIFIED,30 JUN 2005,n/a
filename_1738526799185.pdf,01 FEB 1974,AMEMBASSY LA PAZ,SECSTATE WASHDC 2136,NA,"SNAR, BL",NA,1974LAPAZ00692,UNCLASSIFIED,30 JUN 2005,"DRUG CONTROL, NARCOTICS, PERSONNEL APPOINTMENTS, PERSONNEL ASSIGNMENTS"
filename_1738526799435.pdf,02 FEB 1974,AMEMBASSY LA PAZ,SECSTATE WASHDC 716 NIACT IMMEDIATE,"EXPEDITED MUNITION REQUIREMENTS, GOVERNMENT OF BOLIVIA.","PFOR, MASS, BL",NA,1974LAPAZ00716,UNCLASSIFIED,30 JUN 2005,"ARMS, AMMUNITION, GOVERNMENT PROCUREMENT, MILITARY AIRLIFTS"
filename_1738526799697.pdf,02 FEB 1974,AMEMBASSY LA PAZ,SECSTATE WASHDC NIACT IMMEDIATE 2143,"EXPEDITED MUNITION REQUIREMENTS, GOVERNMENT OF BOLIVIA.","MASS, PFOR, BW",NA,1974LAPAZ00729,UNCLASSIFIED,30 JUN 2005,"AMMUNITION, GOVERNMENT PROCUREMENT, MILITARY AIRLIFTS"
filename_1738526800228.pdf,04 FEB 1974,AMEMBASSY LA PAZ,SECSTATE WASHDC 2154,NA,"BEXP, ETRD, EMIN, BL",NA,1974LAPAZ00742,UNCLASSIFIED,30 JUN 2005,"ZINC, CONSTRUCTION, MINING INDUSTRY"
filename_1738526800336.pdf,06 FEB 1974,AMEMBASSY LA PAZ,SECSTATE WASHDC 2172,REQUEST FOR USIA PREPARATION COMPREHENSIVE NEWS STORY ON PL 480 DEVELOPMENTS.,SUBJECT: REQUEST FOR USIA PREPARATION COMPREHENSIVE NEWS,NA,1974LAPAZ00783,UNCLASSIFIED,30 JUN 2005,"PL 480, AGREEMENTS, ECONOMIC ASSISTANCE, PRESS COMMENTS, DEVELOPMENT PROGRAMS, FOODS, FOREIGN POLICY"
filename_1738526800488.pdf,07 FEB 1974,AMEMBASSY LA PAZ,AMEMBASSY LIMA,NA,"EAGR, BL",LIMA 978,1974LAPAZ00841,UNCLASSIFIED,30 JUN 2005,"TOURISM, AIR TRANSPORTATION, VISITS"
filename_1738526800821.pdf,08 FEB 1974,AMEMBASSY LA PAZ,SECSTATE WASHDC 2219,NA,"ETEL, EFIN, BL",NA,1974LAPAZ00879,UNCLASSIFIED,30 JUN 2005,"POSTAL SERVICE, DEBTS"
filename_1738526801243.pdf,08 FEB 1974,AMEMBASSY LA PAZ,USCINCSO IMMEDIATE NIACT,NA,"EAID, BL",STATE 026462 TO LA PAZ REPEATED TO USCINCSO,1974LAPAZ00874,UNCLASSIFIED,30 JUN 2005,"AIR TRANSPORTATION, DISASTER RELIEF, SUPPLIES, FLOOD CONTROL, RELIEF (ASSISTANCE)"
filename_1738526801708.pdf,08 FEB 1974,AMEMBASSY LA PAZ,SECSTATE WASHDC 2218,FOREIGN MINISTERS' MEETING MEXICO,PFOR OCON XM MX BL,NA,1974LAPAZ00878,UNCLASSIFIED,30 JUN 2005,"PRESS COMMENTS, MEETING AGENDA, FOREIGN RELATIONS, LESS DEVELOPED COUNTRIES, FOREIGN MINISTERS"
filename_1738526802199.pdf,11 FEB 1974,AMEMBASSY LA PAZ,USINFO WASHDC,NA,"PFOR, BL, XR, XS, XL, PRESENCIA",NA,1974LAPAZ00907,UNCLASSIFIED,30 JUN 2005,"FOREIGN RELATIONS, PRESS COMMENTS, PANAMA CANAL TREATY, NEGOTIATIONS, MAGAZINES"
filename_1738526806320.pdf,11 FEB 1974,AMEMBASSY LA PAZ,SECSTATE WASHDC 2233,NA,MASS BL,STATE 023517,1974LAPAZ00900,UNCLASSIFIED,30 JUN 2005,"MILITARY ASSISTANCE, MILITARY ASSISTANCE PROGRAMS"
filename_1738526806402.pdf,13 FEB 1974,AMEMBASSY LA PAZ,SECSTATE WASHDC PRIORITY 2261,NARCOTICS CONTROL BUDGET - BOLIVIA,"SNAR, BL",STATE 008753,1974LAPAZ00963,UNCLASSIFIED,30 JUN 2005,"DRUG CONTROL, BUDGETS, PERSONNEL TRAINING, FUND ALLOTMENT, DRUG TRAFFIC, POLICE FORCES"
filename_1738526806897.pdf,13 FEB 1974,AMEMBASSY LA PAZ,SECSTATE WASHDC PRIORITY 2264,NA,PFOR XM BL,NA,1974LAPAZ00966,UNCLASSIFIED,30 JUN 2005,"MEETING AGENDA, ECONOMIC ASSISTANCE, LESS DEVELOPED COUNTRIES, FOREIGN MINISTERS MEETINGS, DIPLOMATIC"
filename_1738526807836.pdf,13 FEB 1974,AMEMBASSY LA PAZ,SECSTATE WASHDC PRIORITY 2268,NA,CASC (KISH PITA),NA,1974LAPAZ00971,UNCLASSIFIED,30 JUN 2005,n/a
filename_1738526808857.pdf,14 FEB 1974,AMEMBASSY LA PAZ,DEA HQS WASHDC,DEA SIX-WEEK INTERNATIONAL DRUG ENFORCEMENT OFFICIERS SCHOOL NO. 5,"SNAR, BL",DEA 468,1974LAPAZ00992,UNCLASSIFIED,30 JUN 2005,"PERSONNEL TRAINING, DRUG CONTROL"
filename_1738526808959.pdf,20 FEB 1974,AMEMBASSY LA PAZ,SECSTATE WASHDC 2318,REQUEST FOR FAA INSPECTOR,"ETRN, BL",LIMA 0921,1974LAPAZ01086,UNCLASSIFIED,30 JUN 2005,"CIVIL AVIATION, PROCUREMENT, AIRLINES, JET AIRCRAFT, AVIATION REGULATIONS"
filename_1738526809111.pdf,14 FEB 1974,AMEMBASSY LA PAZ,SECSTATE WASHDC PRIORITY 2288,NA,EFIN BL,BINNS-BREWIN LETTER OF FEBRUARY 5,1974LAPAZ01007,UNCLASSIFIED,30 JUN 2005,"DOCUMENTS, FOREIGN INVESTMENTS"
filename_1738526809140.pdf,14 FEB 1974,AMEMBASSY LA PAZ,SECSTATE WASHDC PRIORITY 2274,NA,PFOR XM BL,LA PAZ 966,1974LAPAZ00985,UNCLASSIFIED,30 JUN 2005,"LESS DEVELOPED COUNTRIES, LANDLOCKED COUNTRIES, FOREIGN MINISTERS MEETINGS, FOREIGN POLICY POSITION,"
filename_1738526810141.pdf,21 FEB 1974,AMEMBASSY LA PAZ,SECSTATE WASHDC IMMEDIATE 2329,NA,PARM ICRC VN,NA,1974LAPAZ01114,UNCLASSIFIED,30 JUN 2005,"LAW, WAR, GENEVA CONVENTIONS, FOREIGN POLICY POSITION, MEETINGS, MEETING DELEGATIONS"
filename_1738526810469.pdf,23 FEB 1974,AMEMBASSY LA PAZ,SECSTATE WASHDC 2356,NA,"BPRO, BL",STATE 33637,1974LAPAZ01184,UNCLASSIFIED,30 JUN 2005,n/a
filename_1738526810876.pdf,28 FEB 1974,AMEMBASSY LA PAZ,SECSTATE WASHDC 2365,NA,"BL, PFOR",NA,1974LAPAZ01221,UNCLASSIFIED,30 JUN 2005,"PRESS COMMENTS, FOREIGN RELATIONS, FOREIGN MINISTERS MEETINGS, PUBLIC ATTITUDES, FOREIGN POLICY POSITION"
filename_1738526811747.pdf,01 MAR 1974,AMEMBASSY LA PAZ,SECSTATE WASHDC 2384,LETTER FROM SECRETARY KISSINGER TO BOLIVIAN FOREIGN MINISTER,PFOR BL,STATE 038863,1974LAPAZ01251,UNCLASSIFIED,30 JUN 2005,PFOR BL
filename_1738526812674.pdf,01 MAR 1974,AMEMBASSY LA PAZ,SECSTATE WASHDC 2387,TRAVEL OF PRESIDENT BANZER,"OVIP, BL",NA,1974LAPAZ01259,UNCLASSIFIED,30 JUN 2005,n/a
filename_1738526813266.pdf,04 MAR 1974,AMEMBASSY LA PAZ,SECSTATE WASHDC 2423,NA,PFOR EAID BL,NA,1974LAPAZ01325,UNCLASSIFIED,30 JUN 2005,"DISASTER RELIEF, DEVELOPMENT FINANCE, FOREIGN ASSISTANCE PROGRAMS"
filename_1738526815274.pdf,01 MAR 1974,AMEMBASSY LA PAZ,SECSTATE WASHDC 2399,NA,MASS BL,(A) STATE 026354; (B) LA PAZ 0608; DEPARTMENT PASS DOD/ISA,1974LAPAZ01291,UNCLASSIFIED,30 JUN 2005,"PROCUREMENT, MILITARY EQUIPMENT, MILITARY ASSISTANCE"
filename_1738526818466.pdf,05 MAR 1974,AMEMBASSY LA PAZ,SECSTATE WASHDC 2426,NA,"EGEN, IA-ECOSOC, BL",STATE 039787,1974LAPAZ01329,UNCLASSIFIED,30 JUN 2005,"MEETING AGENDA, MEETINGS, MEETING DELEGATIONS"
filename_1738526818477.pdf,04 MAR 1974,AMEMBASSY LA PAZ,SECSTATE WASHDC PRIORITY 2410,NA,"EAGR, BL",NA,1974LAPAZ01316,UNCLASSIFIED,30 JUN 2005,"SUGAR, AGRICULTURAL PRODUCTION, AGRICULTURAL LAW, COMMITTEE MEETINGS"
filename_1738526821658.pdf,07 MAR 1974,AMEMBASSY LA PAZ,SECSTATE WASHDC IMMEDIATE 2468,NA,"MILI, BL, (RECTANUS, EARL F)",NA,1974LAPAZ01416,UNCLASSIFIED,30 JUN 2005,"MILITARY PERSONNEL, MILITARY VISITS"
filename_1738526821682.pdf,07 MAR 1974,AMEMBASSY LA PAZ,SECSTATE WASHDC 2459,NA,"EGEN, IA-ECOSOC, BL",(A) STATE 039787; (B) LA PAZ 1329,1974LAPAZ01394,UNCLASSIFIED,30 JUN 2005,"MEETING AGENDA, COMMITTEE MEETINGS, NEGOTIATIONS, MEETING DELEGATIONS, MEETINGS"
filename_1738526821899.pdf,06 MAR 1974,AMEMBASSY LA PAZ,USDOC WASHDC,NA,"BTRA, BL",NA,1974LAPAZ01353,UNCLASSIFIED,30 JUN 2005,n/a
filename_1738526822092.pdf,05 MAR 1974,AMEMBASSY LA PAZ,SECSTATE WASHDC 2433,NA,"EAGR, BL",LA PAZ 1316,1974LAPAZ01345,UNCLASSIFIED,30 JUN 2005,"SUGAR, EXPORTS, AGRICULTURAL LAW, IMPORT QUOTAS"
filename_1738526825528.pdf,08 MAR 1974,AMEMBASSY LA PAZ,SECSTATE WASHDC 2478,NA,EOXC,NA,1974LAPAZ01433,UNCLASSIFIED,30 JUN 2005,n/a
filename_1738526825666.pdf,08 MAR 1974,AMEMBASSY LA PAZ,SECSTATE WASHDC 2489,NA,"ETRD, EAGR, BL",NA,1974LAPAZ01454,UNCLASSIFIED,30 JUN 2005,"SUGAR, AGRICULTURAL PRODUCTION, AGRICULTURAL DEVELOPMENT"
filename_1738526825717.pdf,08 MAR 1974,AMEMBASSY LA PAZ,SECSTATE WASHDC 2479,NA,"SNAR, BL","STATE 028448 DATED FEBRUARY 13, AND PREVIOUS.",1974LAPAZ01434,UNCLASSIFIED,30 JUN 2005,"NARCOTICS, DRUG TRAFFIC, EXTRADITION, ARRESTS"
filename_1738526826820.pdf,08 MAR 1974,AMEMBASSY LA PAZ,US DEPT OF AGRICULTURE WASHDC PRIORITY,NA,"BEXP, EAGR, BL",NA,1974LAPAZ01425,UNCLASSIFIED,30 JUN 2005,"WHEAT, AGRICULTURAL COMMODITIES, TRADE OPPORTUNITY REPORTS, FLOUR"
filename_1738526827274.pdf,08 MAR 1974,AMEMBASSY LA PAZ,SECSTATE WASHDC 2456,NA,"EFIN, EMIN, BL",NA,1974LAPAZ01390,UNCLASSIFIED,30 JUN 2005,"PETROLEUM, NATIONAL INCOME, EXPORT PRICES"
filename_1738526827628.pdf,08 MAR 1974,AMEMBASSY LA PAZ,SECSTATE WASHDC 2454,NA,"EFIN, BL",NA,1974LAPAZ01388,UNCLASSIFIED,30 JUN 2005,"ECONOMIC CONDITIONS, ECONOMIC GROWTH, GDP, GOVERNMENT BUDGET, WAGES, VISITS, ECONOMIC ESTIMATES,"
filename_1738526827787.pdf,11 MAR 1974,AMEMBASSY LA PAZ,SECSTATE WASHDC PRIORITY 2503,NA,EAID SNAR BL,STATE 048030,1974LAPAZ01485,UNCLASSIFIED,30 JUN 2005,"DISASTER RELIEF, AGREEMENT DRAFT, PETROLEUM, LOAN AGREEMENTS, FLOODS, PRICES"
filename_1738526828285.pdf,12 MAR 1974,AMEMBASSY LA PAZ,SECSTATE WASHDC 2510,APPLEGATE - YOUNGQUIST LAND EXPROPRIATION CASE REFERENCE: 1) STATE 047381: A) STATE 46969,"ETRD, EAGR",NA,1974LAPAZ01520,UNCLASSIFIED,30 JUN 2005,"LAW, LAND NATIONALIZATION, TAXES, ATTORNEYS, PROPERTY TITLES, FOREIGN POLICY POSITION, LAND REFORMS"
filename_1738526828483.pdf,12 MAR 1974,AMEMBASSY LA PAZ,SECSTATE WASHDC 2509,YPFB--RESCHEDULING OF GULF SETTLEMENT AND IMPLICATIONS FOR BUDGET AND BALANCE OF PAYMENTS,BDIS EFIN BL,STATE 034718; LA PAZ 1277,1974LAPAZ01515,UNCLASSIFIED,30 JUN 2005,"PETROLEUM, SALES, BALANCE OF PAYMENTS, BUDGET DEFICITS, PRICE TRENDS, FOREIGN POLICY POSITION,"
filename_1738526828945.pdf,12 MAR 1974,AMEMBASSY LA PAZ,SECSTATE WASHDC 2504,NA,"PINT, BGEN, BL",NA,1974LAPAZ01488,UNCLASSIFIED,30 JUN 2005,"PRESIDENT, FARM EQUIPMENT, PUBLIC RELATIONS, SPEECHES, AGRICULTURAL WORKERS, LAND REFORMS"
filename_1738526829574.pdf,13 MAR 1974,AMEMBASSY LA PAZ,SECSTATE WASHDC 2515,NA,"BEXP, EAGR, BL",NA,1974LAPAZ01537,UNCLASSIFIED,30 JUN 2005,"AGRICULTURAL PRODUCTION, FOOD SHORTAGE, FOODS, AGRICULTURAL IMPORTS"
filename_1738526829729.pdf,14 MAR 1974,AMEMBASSY LA PAZ,SECSTATE WASHDC 2525,NA,"EAGR, BL",LA PAZ 1425 TO DEPT OF AGRICULTURE,1974LAPAZ01554,UNCLASSIFIED,30 JUN 2005,"PROCUREMENT, AGRICULTURAL COMMODITIES, TRADE OPPORTUNITY REPORTS"
filename_1738526829880.pdf,14 MAR 1974,AMEMBASSY LA PAZ,SECSTATE WASHDC 2527,NA,"ETRD, BL",NA,1974LAPAZ01556,UNCLASSIFIED,30 JUN 2005,"CACAO, INTERNATIONAL ORGANIZATIONS, MEMBERSHIP APPLICATIONS"
filename_1738526830325.pdf,14 MAR 1974,AMEMBASSY LA PAZ,SECSTATE WASHDC 2541,NA,"BEXP, EAGR, BL",NA,1974LAPAZ01571,UNCLASSIFIED,30 JUN 2005,"AGRICULTURAL EXPORTS, TRADE OPPORTUNITY REPORTS"
filename_1738526830803.pdf,14 MAR 1974,AMEMBASSY LA PAZ,SECSTATE WASHDC IMMEDIATE 2538,NA,OVIP,LA PAZ 1550,1974LAPAZ01581,UNCLASSIFIED,30 JUN 2005,n/a
filename_1738526830888.pdf,15 MAR 1974,AMEMBASSY LA PAZ,SECSTATE WASHDC 2552,BOLIVIAN PREPARATIONS FOR THIRD UN LAW OF THE SEA CONFERENCE,"PBOR, UN, BL, PINR",STATE 36434,1974LAPAZ01617,UNCLASSIFIED,30 JUN 2005,"LAW OF THE SEA, MEETING AGENDA, NEGOTIATIONS, MEETINGS"
filename_1738526831026.pdf,18 MAR 1974,AMEMBASSY LA PAZ,SECSTATE WASHDC 2564,NA,"EIND, BDIS, EFIN, BL",NA,1974LAPAZ01649,UNCLASSIFIED,30 JUN 2005,"INDUSTRY, MONEY, NEGOTIATIONS, COURTS, FINANCIAL AGREEMENTS"
filename_1738526831130.pdf,18 MAR 1974,AMEMBASSY LA PAZ,SECSTATE WASHDC 2561,"NEW COMMANDER, U.S. MILITARY GROUP, BOLIVIA",MILI BL,STATE 51854,1974LAPAZ01644,UNCLASSIFIED,30 JUN 2005,"MILITARY PERSONNEL, BIOGRAPHIC INFORMATION, PERSONNEL APPOINTMENTS"
filename_1738526831775.pdf,19 MAR 1974,AMEMBASSY LA PAZ,SECSTATE WASHDC 2569,NA,"ETRD, EAGR, BL",NA,1974LAPAZ01658,UNCLASSIFIED,30 JUN 2005,"LAND NATIONALIZATION, ATTORNEYS, PROPERTY TITLES, LAND REFORMS"
filename_1738526831863.pdf,19 MAR 1974,AMEMBASSY LA PAZ,SECSTATE WASHDC PRIORITY 2572,NA,EAID BL,A. STATE 52986 B. LA PAZ 1485 C. STATE 48030,1974LAPAZ01673,UNCLASSIFIED,30 JUN 2005,"DISASTER RELIEF, ECONOMIC ASSISTANCE, FLOODS, ECONOMIC RECONSTRUCTION, DEVELOPMENT PROGRAMS,"
filename_1738526831954.pdf,21 MAR 1974,AMEMBASSY LA PAZ,SECSTATE WASHDC PRIORITY 2606,NA,"EFIN, BL",NA,1974LAPAZ01754,UNCLASSIFIED,30 JUN 2005,"CENTRAL BANK, BIOGRAPHIC INFORMATION, DEVELOPMENT BANKS, COMMITTEE MEETINGS, ANNUAL REPORTS, FLOODS,"
